{
  "child_log_hash_before_receipt": "b871395102feee01938708a03af7282410622fcadca03ba42e004099f2777060",
  "child_run_id": "01M15GKCVKCMVBYFRCHEK9Y3CC",
  "copied_through_event_id": "evt_012",
  "created_at": "2026-08-29T01:02:02Z",
  "environment_verified": true,
  "environment_verifier": "hmac-sha256:activegraph-bridge-conformance:fixture-v1",
  "external_continuation": "verified",
  "forked_before_event_id": "evt_013",
  "inherited_effects": [
    {
      "footprint": "one_shot",
      "kind": "openai.responses.create",
      "lifecycle": "committed",
      "name": "responses.create",
      "observables": [
        "provider.cost",
        "provider.oracle"
      ],
      "outcome_event_id": "evt_009",
      "replay_source": "recorded",
      "request_event_id": "evt_008",
      "request_hash": "ffcfc8f9ed9c28d12de8264c4900fe8f6cbce11ebab659eea9633b0ceaf70a08",
      "response_hash": "6d5825ae64a38149517a99c7a924a3909a8f39312b7043bd4a32c051b5ab8a22"
    }
  ],
  "parent_event_count_at_fork": 24,
  "parent_log_hash_at_fork": "bc7eae17f22ba471fddb723da2470833cbc59a8adc4361201dafa88124676185",
  "parent_run_id": "01M15GKCV4D5Z7WC9K173KH3B9",
  "prefix_event_count": 12,
  "prefix_external_calls": 0,
  "prefix_hash": "3de3251368f20c4da2d234ac101e8a31b7b3142ede845157d9dcf39d69ccd8e4",
  "receipt_hash": "5d36df7dc177a9801fa8ff6a4b070612fd0b16e4c45207825498fda03af3d3f0",
  "schema_version": "activegraph-bridge/fork-receipt-v1",
  "served_effect_request_ids": [
    "evt_008"
  ],
  "source_fingerprint": {
    "activegraph_version": "1.10.0",
    "agent_code_hash": "0695d5ca6b01a45a434ac1c41ae26bd28fb784415843f3471111cdebfc2505e9",
    "bridge_version": "0.2.0",
    "configuration_hash": "b1dec2f270ad160812c2ca25c8ca68fd8cea88afe81aed3f08e9dba827d8233d",
    "platform": "darwin",
    "python_version": "3.11.15"
  },
  "status": "completed",
  "tail_executed_effect_request_ids": [],
  "target_environment": {
    "algorithm": "hmac-sha256",
    "claims": {
      "child_run_id": "01M15GKCVKCMVBYFRCHEK9Y3CC",
      "forked_before_event_id": "evt_013",
      "parent_run_id": "01M15GKCV4D5Z7WC9K173KH3B9",
      "prefix_hash": "3de3251368f20c4da2d234ac101e8a31b7b3142ede845157d9dcf39d69ccd8e4",
      "target_fingerprint_hash": "bfe7417e604851448e984867a87f196ec195690cf17c0613119c8a3888573373"
    },
    "environment_id": "fixture-clean-room",
    "expires_at": null,
    "issued_at": "2026-08-28T00:00:00Z",
    "issuer": "activegraph-bridge-conformance",
    "key_id": "fixture-v1",
    "schema_version": "activegraph-bridge/environment-attestation-v1",
    "signature": "xdZfl9xJtCN84SOQeghrZm56bSxhpp9MUmlnMwQxPa4",
    "snapshot_id": "fixture-snapshot-v1"
  },
  "target_fingerprint": {
    "activegraph_version": "1.10.0",
    "agent_code_hash": "0695d5ca6b01a45a434ac1c41ae26bd28fb784415843f3471111cdebfc2505e9",
    "bridge_version": "0.2.0",
    "configuration_hash": "b1dec2f270ad160812c2ca25c8ca68fd8cea88afe81aed3f08e9dba827d8233d",
    "platform": "darwin",
    "python_version": "3.11.15"
  },
  "zero_reexecution_verified": true
}
